# dell latitude e6530

$ lsusb 
Bus 002 Device 004: ID 0a5c:5801 Broadcom Corp. BCM5880 Secure Applications Processor with fingerprint swipe sensor
Bus 002 Device 003: ID 413c:2513 Dell Computer Corp. internal USB Hub of E-Port Replicator
Bus 002 Device 002: ID 8087:0024 Intel Corp. Integrated Rate Matching Hub
Bus 002 Device 001: ID 1d6b:0002 Linux Foundation 2.0 root hub
Bus 001 Device 004: ID 0c45:6449 Microdia 
Bus 001 Device 003: ID 413c:8197 Dell Computer Corp. 
Bus 001 Device 002: ID 8087:0024 Intel Corp. Integrated Rate Matching Hub
Bus 001 Device 001: ID 1d6b:0002 Linux Foundation 2.0 root hub
Bus 004 Device 001: ID 1d6b:0003 Linux Foundation 3.0 root hub
Bus 003 Device 011: ID 05af:0802 Jing-Mold Enterprise Co., Ltd 
Bus 003 Device 024: ID 090c:1000 Silicon Motion, Inc. - Taiwan (formerly Feiya Technology Corp.) Flash Drive
Bus 003 Device 010: ID 0461:4d22 Primax Electronics, Ltd 
Bus 003 Device 009: ID 0451:8043 Texas Instruments, Inc. 
Bus 003 Device 005: ID 413c:2513 Dell Computer Corp. internal USB Hub of E-Port Replicator
Bus 003 Device 004: ID 0b95:772a ASIX Electronics Corp. AX88772A Fast Ethernet
Bus 003 Device 003: ID 9710:7830 MosChip Semiconductor MCS7830 10/100 Mbps Ethernet adapter
Bus 003 Device 022: ID 0403:6001 Future Technology Devices International, Ltd FT232 USB-Serial (UART) IC
Bus 003 Device 021: ID 0403:6001 Future Technology Devices International, Ltd FT232 USB-Serial (UART) IC
Bus 003 Device 020: ID 0403:6011 Future Technology Devices International, Ltd FT4232H Quad HS USB-UART/FIFO IC
Bus 003 Device 019: ID 1a40:0101 Terminus Technology Inc. 4-Port HUB
Bus 003 Device 001: ID 1d6b:0002 Linux Foundation 2.0 root hub

$ ls /dev/bus/usb/003/024 
/dev/bus/usb/003/024

$ lsusb -D /dev/bus/usb/003/024 
Device: ID 090c:1000 Silicon Motion, Inc. - Taiwan (formerly Feiya Technology Corp.) Flash Drive
Couldn't open device, some information will be missing
Device Descriptor:
  bLength                18
  bDescriptorType         1
  bcdUSB               2.00
  bDeviceClass            0 (Defined at Interface level)
  bDeviceSubClass         0 
  bDeviceProtocol         0 
  bMaxPacketSize0        64
  idVendor           0x090c Silicon Motion, Inc. - Taiwan (formerly Feiya Technology Corp.)
  idProduct          0x1000 Flash Drive
  bcdDevice           11.00
  iManufacturer           1 
  iProduct                2 
  iSerial                 3 
  bNumConfigurations      1
  Configuration Descriptor:
    bLength                 9
    bDescriptorType         2
    wTotalLength           32
    bNumInterfaces          1
    bConfigurationValue     1
    iConfiguration          0 
    bmAttributes         0x80
      (Bus Powered)
    MaxPower              500mA
    Interface Descriptor:
      bLength                 9
      bDescriptorType         4
      bInterfaceNumber        0
      bAlternateSetting       0
      bNumEndpoints           2
      bInterfaceClass         8 Mass Storage
      bInterfaceSubClass      6 SCSI
      bInterfaceProtocol     80 Bulk-Only
      iInterface              0 
      Endpoint Descriptor:
        bLength                 7
        bDescriptorType         5
        bEndpointAddress     0x81  EP 1 IN
        bmAttributes            2
          Transfer Type            Bulk
          Synch Type               None
          Usage Type               Data
        wMaxPacketSize     0x0200  1x 512 bytes
        bInterval             255
      Endpoint Descriptor:
        bLength                 7
        bDescriptorType         5
        bEndpointAddress     0x02  EP 2 OUT
        bmAttributes            2
          Transfer Type            Bulk
          Synch Type               None
          Usage Type               Data
        wMaxPacketSize     0x0200  1x 512 bytes
        bInterval             255
